{
  "$schema": "../_schema/coach.schema.json",
  "id": "metacognition-coach",
  "version": "1.0.1",
  "habitsFrom": "metacognition-nsw-science",
  "source": "docs/handoffs/mcg-content.js",
  "gameDescriptions": {
    "explicit": "Naming the learning intention and the thinking strategy aloud, so students know what kind of thinking the lesson is building.",
    "model": "Thinking aloud through a problem — including where you get stuck and how you work out of it.",
    "ask": "Asking open questions — and teaching students to ask themselves — that probe how they’re reasoning, not just what they know.",
    "plan": "Giving students a planning scaffold — a checklist, organiser or sequence of steps — to use before they start a task.",
    "collab": "Having students compare how they each reasoned through the same problem, so they meet strategies other than their own.",
    "evaluate": "Having students judge their thinking process — not only their answer — against criteria or their own goals.",
    "challenge": "Once students are secure, setting an unfamiliar or harder task to test whether their thinking transfers.",
    "practise": "Reusing the same thinking routine across different content, spaced over weeks, until it becomes durable rather than one-off.",
    "checkin": "Periodically checking whether a thinking habit has become independent — used unprompted — rather than only when reminded."
  },
  "units": [
    {
      "id": "explicit",
      "short": "Name the thinking, not just the topic",
      "intro": "Naming not just what students will learn, but what kind of thinking the lesson is building — out loud — so the strategy becomes visible and can travel beyond this lesson.",
      "steps": [
        {
          "type": "choice",
          "kind": "def",
          "scorable": true,
          "distractors": [
            {
              "habit": "model",
              "contrast": "Modelling shows your reasoning in action; being explicit names the strategy so students know what they’re practising."
            },
            {
              "habit": "plan",
              "contrast": "A planning scaffold is a tool students use. Being explicit is you naming the thinking the tool is for."
            },
            {
              "habit": "ask",
              "contrast": "Questioning draws out students’ reasoning. Being explicit tells them which kind of reasoning matters today."
            }
          ],
          "good": "That’s it. The move is naming the thinking as well as the content — out loud, on the board, every time.",
          "coach": "Most lessons are explicit about content and silent about thinking. That silence is why strategies don’t transfer."
        },
        {
          "type": "tf",
          "kind": "spot",
          "scorable": true,
          "eyebrow": "Spot the habit",
          "q": "Is this teacher being explicit about the thinking?",
          "scene": {
            "ctx": {
              "stages": [
                "stage-4"
              ],
              "focusArea": "living-systems"
            },
            "t": "Two intentions on the board: “<b>Science:</b> food webs and energy flow. <b>Thinking:</b> we’re practising systems thinking — deliberately looking for effects more than one step away. You’ll use this in geography too.”"
          },
          "answer": true,
          "good": "Yes. Content and thinking sit side by side, and the teacher says where else the thinking applies.",
          "bad": "Look again — the second intention names a specific thinking strategy and says why it matters beyond this lesson. That’s the habit.",
          "coach": "The line “you’ll use this in geography too” is doing real work: it tells students the strategy is portable."
        },
        {
          "type": "choice",
          "kind": "recall",
          "scorable": true,
          "eyebrow": "Quick recall",
          "q": "Why does naming the thinking strategy matter?",
          "opts": [
            {
              "t": "It speeds the lesson up, because students know what’s coming next.",
              "fb": "Naming the strategy takes a little time. The payoff is elsewhere."
            },
            {
              "t": "It helps the strategy transfer beyond the lesson it was learned in.",
              "correct": true
            },
            {
              "t": "Once students know its name, they no longer need to practise it.",
              "fb": "Naming isn’t a substitute for practice — it’s what makes practice recognisable as the same skill each time."
            },
            {
              "t": "It replaces the content learning intention with a clearer skills goal.",
              "fb": "It sits alongside the content intention, not instead of it."
            }
          ],
          "good": "Right. A strategy students can name is a strategy they can recognise and reach for again in a new context.",
          "coach": "If students can’t tell you what kind of thinking they did today, they’ll struggle to do it on purpose tomorrow."
        },
        {
          "type": "choice",
          "kind": "scenario",
          "scorable": true,
          "eyebrow": "Scenario",
          "q": "How do you open the lesson?",
          "scene": {
            "ctx": {
              "stages": [
                "stage-5"
              ],
              "focusArea": "disease"
            },
            "t": "Today students evaluate a news story claiming a supplement prevents colds. You’re about to begin."
          },
          "opts": [
            {
              "t": "“Today we’re learning about the immune system — how your body recognises a pathogen, and how vaccines train it to respond faster.”",
              "fb": "This names the content and leaves the thinking invisible. Students may evaluate the article without realising that evaluating is the skill."
            },
            {
              "t": "Write the syllabus dot point on the board, read it aloud, and have students copy it into their books as the learning intention for today’s lesson.",
              "fb": "The dot point names what NESA requires. It doesn’t tell students what kind of thinking to do."
            },
            {
              "t": "“The science today is immunity. The thinking skill is noticing when a claim outruns its evidence — you’ll use it on every health headline you ever read.”",
              "correct": true
            },
            {
              "t": "“Here’s a headline about a new immunity supplement. Read the article and tell me what you think — do you believe it?”",
              "partial": true,
              "fb": "A good hook, and it invites thinking — but it doesn’t name which thinking. Hook first, then name it."
            }
          ],
          "good": "Yes. Two strands, both named, with a reason the thinking strand matters outside the classroom.",
          "part": "Close. Opening with the article is engaging, but students still don’t know what thinking they’re practising. Add the name.",
          "coach": "A quick test: could a student, leaving the room, tell a friend what kind of thinking they practised? If not, it wasn’t explicit."
        },
        {
          "type": "choice",
          "kind": "scenario",
          "scorable": true,
          "eyebrow": "Scenario · the hard one",
          "q": "What do you do?",
          "scene": {
            "ctx": {
              "stages": [
                "stage-6"
              ],
              "syllabus": "chemistry-stage6-2017",
              "module": "chem-m6",
              "acknowledgedSuperseded": true
            },
            "t": "Your class has a four-stage problem card for titration calculations — understand, plan, solve, check. You notice students treating it as a worksheet: ticking boxes after they’ve already finished."
          },
          "opts": [
            {
              "t": "Collect the cards at the end of each lesson and mark them for completion, so students see that filling in every step counts.",
              "fb": "Marking completion rewards the box-ticking you’re worried about."
            },
            {
              "t": "Take the cards away for now — if students are only ticking boxes, the card has become busywork, and it’s getting in the way of the real problem-solving you want them to do.",
              "fb": "The card isn’t the problem. Students don’t yet know what it’s for."
            },
            {
              "t": "Give them a longer set of practice problems with the card, so the routine becomes automatic through repetition.",
              "fb": "More practice of a misunderstood routine strengthens the misunderstanding."
            },
            {
              "t": "Stop and name it: “This card isn’t for this topic — it’s how reliable problem-solvers think. The check step is the one that catches the slip before your final line.”",
              "correct": true
            }
          ],
          "good": "Exactly. When a scaffold becomes a chore, students have lost sight of the thinking it represents. Naming it restores the purpose.",
          "coach": "Being explicit isn’t a one-off at the start of a unit. You re-name the strategy whenever students lose sight of why it’s there."
        },
        {
          "type": "apply",
          "eyebrow": "Design the move",
          "q": "Write a two-strand learning intention",
          "sub": "For a lesson you’ll teach soon, write one intention for the <b>science</b> and one for the <b>thinking</b>.",
          "placeholder": "Science: … Thinking: …",
          "criteria": [
            "The science intention names specific content",
            "The thinking intention names a specific strategy — not just “think carefully”",
            "It says why the thinking matters beyond this lesson"
          ]
        },
        {
          "type": "commit",
          "eyebrow": "Take it to your classroom",
          "q": "Make it real",